{
  "contract_version": "2.0",
  "article_id": "A000369",
  "url": "https://example.com/article-369",
  "status": "PASS_WITH_WARNING",
  "diagnosis": "LOW_SAMPLE",
  "primary_intent": "リール編集アプリを知りたい",
  "preservation_score": 62,
  "change_budget_percent": 18,
  "rewrite_level": "L2",
  "rewrite_scope": "S3",
  "risk_level": "LOW",
  "changed_sections": ["seo_title","meta_description","introduction","heading","faq","internal_link"],
  "protected_elements": ["ads","affiliate_links","experience","original_review","comparison_table","conclusion"],
  "warnings": ["表示回数が少なく効果判定には追加データが必要"],
  "remeasurement_days": 28,
  "validation": {"result":"PASS_WITH_WARNING","failed_rules":[],"warning_rules":["VAL-015"]},
  "recommendation_reason": "局所改善は妥当だが、LOW_SAMPLEのため28日後の再測定が必要。"
}
