{
  "contract_version": "2.0",
  "article_id": "A000001",
  "url": "https://example.com/article",
  "status": "PASS",
  "diagnosis": "STABLE",
  "primary_intent": "情報収集",
  "preservation_score": 100,
  "change_budget_percent": 0,
  "rewrite_level": "L0",
  "rewrite_scope": "S0",
  "risk_level": "LOW",
  "changed_sections": [],
  "protected_elements": ["ads","affiliate_links","experience","conclusion"],
  "warnings": [],
  "remeasurement_days": null,
  "validation": {"result":"PASS","failed_rules":[],"warning_rules":[]},
  "recommendation_reason": "検索意図と現状の構成が整合し、変更の必要性が確認できないため。"
}
